{
  "$defs": {
    "actor": {
      "additionalProperties": false,
      "properties": {
        "actorId": {
          "minLength": 1,
          "type": "string"
        },
        "actorType": {
          "enum": [
            "human",
            "agent",
            "kernel"
          ]
        }
      },
      "required": [
        "actorType",
        "actorId"
      ],
      "type": "object"
    },
    "exclusionRef": {
      "additionalProperties": false,
      "properties": {
        "$exclusion": {
          "$ref": "#/$defs/id"
        }
      },
      "required": [
        "$exclusion"
      ],
      "type": "object"
    },
    "gapRef": {
      "additionalProperties": false,
      "properties": {
        "$gap": {
          "$ref": "#/$defs/id"
        }
      },
      "required": [
        "$gap"
      ],
      "type": "object"
    },
    "id": {
      "pattern": "^[a-z0-9][a-z0-9._:-]*$",
      "type": "string"
    },
    "provenance": {
      "additionalProperties": false,
      "properties": {
        "extractedAt": {
          "type": "string"
        },
        "extractor": {
          "type": "string"
        },
        "locator": {
          "type": "string"
        },
        "sourceArtifact": {
          "type": "string"
        }
      },
      "required": [
        "sourceArtifact",
        "locator",
        "extractor",
        "extractedAt"
      ],
      "type": "object"
    },
    "timestamp": {
      "pattern": "^\\d{4}-\\d{2}-\\d{2}(T\\d{2}:\\d{2}:\\d{2}(\\.\\d+)?Z)?$",
      "type": "string"
    }
  },
  "$id": "https://docket.offgriddevices.com/schema/Policy.schema.json",
  "$schema": "https://json-schema.org/draft/2020-12/schema",
  "additionalProperties": false,
  "description": "Decision-class policy: readiness rules, tailoring, aggregation, blocking rules. Versioned.",
  "properties": {
    "aggregationK": {
      "type": "integer"
    },
    "blockingRules": {
      "items": {
        "type": "string"
      },
      "type": "array"
    },
    "confidence": {
      "enum": [
        "explicit",
        "inferred",
        "absent"
      ]
    },
    "createdAt": {
      "$ref": "#/$defs/timestamp"
    },
    "createdBy": {
      "$ref": "#/$defs/actor"
    },
    "decisionClass": {
      "type": "string"
    },
    "expectedDaysByState": {
      "additionalProperties": {
        "type": "integer"
      },
      "type": "object"
    },
    "id": {
      "$ref": "#/$defs/id"
    },
    "ingestionProvenance": {
      "$ref": "#/$defs/provenance"
    },
    "method": {
      "enum": [
        "mavt",
        "ahp",
        "topsis",
        "pugh"
      ]
    },
    "nSimplex": {
      "type": "integer"
    },
    "name": {
      "type": "string"
    },
    "prohibitedExclusionReasons": {
      "items": {
        "type": "string"
      },
      "type": "array"
    },
    "requireAllLinchpinsVaried": {
      "type": "boolean"
    },
    "requiredBiasChecks": {
      "items": {
        "type": "string"
      },
      "type": "array"
    },
    "rev": {
      "minimum": 1,
      "type": "integer"
    },
    "supersedes": {
      "$ref": "#/$defs/id"
    },
    "tailoring": {
      "type": "string"
    },
    "type": {
      "const": "Policy"
    },
    "version": {
      "type": "string"
    }
  },
  "required": [
    "id",
    "type",
    "rev",
    "createdBy",
    "createdAt",
    "name",
    "version",
    "decisionClass",
    "method",
    "tailoring",
    "aggregationK",
    "requiredBiasChecks",
    "requireAllLinchpinsVaried",
    "prohibitedExclusionReasons",
    "blockingRules",
    "nSimplex"
  ],
  "title": "Policy",
  "type": "object"
}
